CITY / COMMUNITY**	CASES		(Case Rate) City of Agoura Hills	1067	(	5109	)	  City of Alhambra	6921	(	7980	)	  City of Arcadia	2761	(	4781	)	  City of Artesia	2083	(	12403	)	  City of Avalon	16	(	414	)	  City of Azusa	6344	(	12678	)	  City of Baldwin Park	13204	(	17200	)	  City of Bell	6814	(	18755	)	  City of Bell Gardens	8394	(	19489	)	  City of Bellflower	10848	(	13955	)	  City of Beverly Hills	2712	(	7856	)	  City of Bradbury	39	(	3648	)	  City of Burbank	9010	(	8406	)	  City of Calabasas	1302	(	5353	)	  City of Carson	9933	(	10584	)	  City of Cerritos	3092	(	6176	)	  City of Claremont	2296	(	6293	)	  City of Commerce*	2403	(	18387	)	  City of Compton	17209	(	17226	)	  City of Covina	6426	(	13106	)	  City of Cudahy	4822	(	19805	)	  City of Culver City	2243	(	5626	)	  City of Diamond Bar	3286	(	5713	)	  City of Downey	17654	(	15450	)	  City of Duarte	2325	(	10561	)	  City of El Monte	17271	(	14728	)	  City of El Segundo	745	(	4438	)	  City of Gardena	6435	(	10496	)	  City of Glendale	20293	(	9827	)	  City of Glendora	4859	(	9209	)	  City of Hawaiian Gardens	2248	(	15318	)	  City of Hawthorne	10649	(	11994	)	  City of Hermosa Beach	1030	(	5236	)	  City of Hidden Hills	92	(	4868	)	  City of Huntington Park	11278	(	18960	)	  City of Industry	173	(	39588	)	  City of Inglewood	13837	(	12182	)	  City of Irwindale	253	(	17341	)	  City of La Canada Flintridge	772	(	3731	)	  City of La Habra Heights	117	(	2145	)	  City of La Mirada	4326	(	8722	)	  City of La Puente	6724	(	16522	)	  City of La Verne	2924	(	8786	)	  City of Lakewood	7382	(	9186	)	  City of Lancaster*	22559	(	13962	)	  City of Lawndale	3637	(	10820	)	  City of Lomita	1517	(	7318	)	  City of Lynwood*	13383	(	18575	)	  City of Malibu	449	(	3464	)	  City of Manhattan Beach	1389	(	3858	)	  City of Maywood	5251	(	18721	)	  City of Monrovia	3211	(	8276	)	  City of Montebello	10235	(	15899	)	  City of Monterey Park	4852	(	7793	)	  City of Norwalk	16231	(	15081	)	  City of Palmdale	24906	(	15667	)	  City of Palos Verdes Estates	490	(	3624	)	  City of Paramount	10018	(	17882	)	  City of Pico Rivera	11215	(	17446	)	  City of Pomona	24536	(	15735	)	  City of Rancho Palos Verdes	1557	(	3642	)	  City of Redondo Beach	2904	(	4227	)	  City of Rolling Hills	59	(	3041	)	  City of Rolling Hills Estates	292	(	3599	)	  City of Rosemead	4976	(	8990	)	  City of San Dimas*	3260	(	9445	)	  City of San Fernando	5311	(	21579	)	  City of San Gabriel	3266	(	7975	)	  City of San Marino	388	(	2922	)	  City of Santa Clarita	20705	(	9393	)	  City of Santa Fe Springs	2891	(	15743	)	  City of Santa Monica	4872	(	5270	)	  City of Sierra Madre	475	(	4323	)	  City of Signal Hill	1146	(	9714	)	  City of South El Monte	3438	(	16462	)	  City of South Gate	18761	(	19114	)	  City of South Pasadena	1333	(	5116	)	  City of Temple City	2383	(	6537	)	  City of Torrance	7530	(	5045	)	  City of Vernon	124	(	59330	)	  City of Walnut	1774	(	5810	)	  City of West Covina	12969	(	11982	)	  City of West Hollywood	2391	(	6471	)	  City of Westlake Village	117	(	1400	)	  City of Whittier	11202	(	12812	)	  Los Angeles	509409	(	12595	)	  Los Angeles - Adams-Normandie	1210	(	14752	)	  Los Angeles - Alsace	1603	(	12881	)	  Los Angeles - Angeles National Forest	5	(	12500	)	  Los Angeles - Angelino Heights	291	(	11631	)	  Los Angeles - Arleta	7121	(	20719	)	  Los Angeles - Atwater Village	1431	(	9757	)	  Los Angeles - Baldwin Hills	2782	(	8938	)	  Los Angeles - Bel Air	407	(	4829	)	  Los Angeles - Beverly Crest	663	(	5293	)	  Los Angeles - Beverlywood	948	(	7197	)	  Los Angeles - Boyle Heights*	17553	(	20203	)	  Los Angeles - Brentwood	1593	(	5146	)	  Los Angeles - Brookside	33	(	5680	)	  Los Angeles - Cadillac-Corning	723	(	10153	)	  Los Angeles - Canoga Park	9512	(	14569	)	  Los Angeles - Carthay	959	(	6677	)	  Los Angeles - Central	7666	(	19660	)	  Los Angeles - Century City	639	(	4995	)	  Los Angeles - Century Palms/Cove	6318	(	18711	)	  Los Angeles - Chatsworth	3716	(	10027	)	  Los Angeles - Cheviot Hills	464	(	5059	)	  Los Angeles - Chinatown	741	(	9238	)	  Los Angeles - Cloverdale/Cochran	1614	(	11090	)	  Los Angeles - Country Club Park	1562	(	10308	)	  Los Angeles - Crenshaw District	1484	(	10731	)	  Los Angeles - Crestview	1042	(	9166	)	  Los Angeles - Del Rey	2046	(	6835	)	  Los Angeles - Downtown*	4140	(	15051	)	  Los Angeles - Eagle Rock	3706	(	9361	)	  Los Angeles - East Hollywood	3294	(	11247	)	  Los Angeles - Echo Park	1351	(	9477	)	  Los Angeles - El Sereno	6256	(	14964	)	  Los Angeles - Elysian Park	518	(	9069	)	  Los Angeles - Elysian Valley	1316	(	12939	)	  Los Angeles - Encino	3485	(	7715	)	  Los Angeles - Exposition	367	(	11034	)	  Los Angeles - Exposition Park	6270	(	13959	)	  Los Angeles - Faircrest Heights	274	(	7611	)	  Los Angeles - Figueroa Park Square	1363	(	15629	)	  Los Angeles - Florence-Firestone	9342	(	19690	)	  Los Angeles - Glassell Park	3456	(	10935	)	  Los Angeles - Gramercy Place	1353	(	12570	)	  Los Angeles - Granada Hills	6637	(	11406	)	  Los Angeles - Green Meadows	3996	(	18582	)	  Los Angeles - Hancock Park	1059	(	6215	)	  Los Angeles - Harbor City	2572	(	8848	)	  Los Angeles - Harbor Gateway	5001	(	11470	)	  Los Angeles - Harbor Pines	174	(	7223	)	  Los Angeles - Harvard Heights	2606	(	14450	)	  Los Angeles - Harvard Park	7280	(	19191	)	  Los Angeles - Highland Park	5833	(	12054	)	  Los Angeles - Historic Filipinotown	2080	(	14996	)	  Los Angeles - Hollywood	5649	(	8276	)	  Los Angeles - Hollywood Hills	1596	(	5422	)	  Los Angeles - Hyde Park	3777	(	13234	)	  Los Angeles - Jefferson Park	1176	(	14567	)	  Los Angeles - Koreatown	5612	(	10856	)	  Los Angeles - Lafayette Square	540	(	11845	)	  Los Angeles - Lake Balboa	5473	(	12967	)	  Los Angeles - Lakeview Terrace	2334	(	17772	)	  Los Angeles - Leimert Park	1618	(	10620	)	  Los Angeles - Lincoln Heights	5132	(	15744	)	  Los Angeles - Little Armenia	1175	(	14642	)	  Los Angeles - Little Bangladesh	2816	(	9935	)	  Los Angeles - Little Tokyo	405	(	12927	)	  Los Angeles - Longwood	590	(	13708	)	  Los Angeles - Los Feliz	1072	(	4961	)	  Los Angeles - Manchester Square	972	(	11387	)	  Los Angeles - Mandeville Canyon	162	(	5186	)	  Los Angeles - Mar Vista	2090	(	4921	)	  Los Angeles - Marina Peninsula	151	(	3463	)	  Los Angeles - Melrose	8302	(	10685	)	  Los Angeles - Mid-city	1227	(	8164	)	  Los Angeles - Miracle Mile	1014	(	5638	)	  Los Angeles - Mission Hills	4368	(	18106	)	  Los Angeles - Mt. Washington	2876	(	11911	)	  Los Angeles - North Hills	9428	(	15311	)	  Los Angeles - North Hollywood	21029	(	13888	)	  Los Angeles - Northridge	7677	(	10999	)	  Los Angeles - Pacific Palisades	859	(	4035	)	  Los Angeles - Pacoima	17362	(	22554	)	  Los Angeles - Palisades Highlands	150	(	3900	)	  Los Angeles - Palms	2637	(	6010	)	  Los Angeles - Panorama City	13609	(	18085	)	  Los Angeles - Park La Brea	644	(	4742	)	  Los Angeles - Pico-Union	7168	(	17131	)	  Los Angeles - Playa Del Rey	115	(	3598	)	  Los Angeles - Playa Vista	616	(	5627	)	  Los Angeles - Porter Ranch	2496	(	7014	)	  Los Angeles - Rancho Park	380	(	5793	)	  Los Angeles - Regent Square	261	(	9388	)	  Los Angeles - Reseda	11622	(	15169	)	  Los Angeles - Reseda Ranch	709	(	15293	)	  Los Angeles - Reynier Village	273	(	6457	)	  Los Angeles - San Pedro*	7336	(	9401	)	  Los Angeles - Shadow Hills	401	(	9027	)	  Los Angeles - Sherman Oaks	5956	(	6826	)	  Los Angeles - Silverlake	3231	(	7329	)	  Los Angeles - South Carthay	739	(	6975	)	  Los Angeles - South Park	7400	(	19494	)	  Los Angeles - St Elmo Village	705	(	15380	)	  Los Angeles - Studio City	1420	(	6328	)	  Los Angeles - Sun Valley	9568	(	18231	)	  Los Angeles - Sunland	2319	(	11363	)	  Los Angeles - Sycamore Square	29	(	4482	)	  Los Angeles - Sylmar*	16265	(	19740	)	  Los Angeles - Tarzana	3377	(	10937	)	  Los Angeles - Temple-Beaudry	5115	(	12955	)	  Los Angeles - Thai Town	907	(	9247	)	  Los Angeles - Toluca Lake	518	(	5951	)	  Los Angeles - Toluca Terrace	146	(	11179	)	  Los Angeles - Toluca Woods	111	(	5974	)	  Los Angeles - Tujunga	2982	(	10723	)	  Los Angeles - University Hills	272	(	7932	)	  Los Angeles - University Park	3597	(	13101	)	  Los Angeles - Valley Glen	3895	(	12976	)	  Los Angeles - Valley Village	2089	(	8451	)	  Los Angeles - Van Nuys*	14751	(	15828	)	  Los Angeles - Venice	1758	(	5188	)	  Los Angeles - Vermont Knolls	2875	(	16715	)	  Los Angeles - Vermont Square	1488	(	19433	)	  Los Angeles - Vermont Vista	7614	(	18487	)	  Los Angeles - Vernon Central	11150	(	21443	)	  Los Angeles - Victoria Park	1058	(	12597	)	  Los Angeles - View Heights	229	(	6199	)	  Los Angeles - Watts	7588	(	17781	)	  Los Angeles - Wellington Square	588	(	11963	)	  Los Angeles - West Adams	4035	(	14604	)	  Los Angeles - West Hills	3088	(	7616	)	  Los Angeles - West Los Angeles	2466	(	6552	)	  Los Angeles - West Vernon	10216	(	19044	)	  Los Angeles - Westchester	2579	(	4998	)	  Los Angeles - Westlake	7815	(	13167	)	  Los Angeles - Westwood	2854	(	5275	)	  Los Angeles - Wholesale District*	6429	(	17795	)	  Los Angeles - Wilmington	8521	(	15085	)	  Los Angeles - Wilshire Center	5657	(	11276	)	  Los Angeles - Winnetka	6857	(	13241	)	  Los Angeles - Woodland Hills	5182	(	7614	)	  Unincorporated - Acton	499	(	6260	)	  Unincorporated - Agua Dulce	291	(	6999	)	  Unincorporated - Altadena	3361	(	7705	)	  Unincorporated - Anaverde	150	(	9947	)	  Unincorporated - Angeles National Forest	33	(	2651	)	  Unincorporated - Arcadia	612	(	7668	)	  Unincorporated - Athens-Westmont	6426	(	15141	)	  Unincorporated - Athens Village	1078	(	22013	)	  Unincorporated - Avocado Heights	1092	(	16118	)	  Unincorporated - Azusa	2383	(	14966	)	  Unincorporated - Bassett	2642	(	17831	)	  Unincorporated - Bouquet Canyon	49	(	4567	)	  Unincorporated - Bradbury	52	(	48148	)	  Unincorporated - Canyon Country	855	(	11064	)	  Unincorporated - Castaic*	3764	(	13843	)	  Unincorporated - Cerritos	72	(	12266	)	  Unincorporated - Charter Oak	0	(	0	)	  Unincorporated - Claremont	41	(	5840	)	  Unincorporated - Covina	2351	(	13978	)	  Unincorporated - Covina (Charter Oak)	1545	(	11754	)	  Unincorporated - Del Aire	318	(	7239	)	  Unincorporated - Del Rey	32	(	10063	)	  Unincorporated - Del Sur	171	(	7081	)	  Unincorporated - Desert View Highlands	366	(	14681	)	  Unincorporated - Duarte	856	(	19332	)	  Unincorporated - East Covina	34	(	10334	)	  Unincorporated - East La Mirada	508	(	9599	)	  Unincorporated - East Lancaster	17	(	14912	)	  Unincorporated - East Los Angeles	25065	(	20009	)	  Unincorporated - East Pasadena	222	(	3467	)	  Unincorporated - East Rancho Dominguez	2801	(	18298	)	  Unincorporated - East Whittier	477	(	8990	)	  Unincorporated - El Camino Village	843	(	9589	)	  Unincorporated - El Monte	24	(	16552	)	  Unincorporated - Elizabeth Lake	82	(	4937	)	  Unincorporated - Florence-Firestone	13693	(	21162	)	  Unincorporated - Franklin Canyon	1	(	8333	)	  Unincorporated - Glendora	69	(	10455	)	  Unincorporated - Hacienda Heights	5264	(	9412	)	  Unincorporated - Harbor Gateway	0	(	0	)	  Unincorporated - Hawthorne	322	(	12808	)	  Unincorporated - Hi Vista	45	(	4098	)	  Unincorporated - Kagel/Lopez Canyons	272	(	19263	)	  Unincorporated - La Crescenta-Montrose	1131	(	5712	)	  Unincorporated - La Habra Heights	16	(	2367	)	  Unincorporated - La Rambla	274	(	13205	)	  Unincorporated - La Verne*	167	(	8186	)	  Unincorporated - Ladera Heights	403	(	5699	)	  Unincorporated - Lake Hughes	42	(	6287	)	  Unincorporated - Lake Los Angeles	1604	(	12344	)	  Unincorporated - Lake Manor	133	(	8095	)	  Unincorporated - Lakewood	0	(	0	)	  Unincorporated - Lennox	3567	(	15824	)	  Unincorporated - Leona Valley	114	(	6511	)	  Unincorporated - Littlerock	540	(	13429	)	  Unincorporated - Littlerock/Juniper Hills	126	(	9715	)	  Unincorporated - Littlerock/Pearblossom	537	(	15046	)	  Unincorporated - Llano	41	(	4675	)	  Unincorporated - Marina del Rey	403	(	4282	)	  Unincorporated - Miracle Mile	0	(	0	)	  Unincorporated - Monrovia	377	(	9714	)	  Unincorporated - Newhall	69	(	31364	)	  Unincorporated - North Lancaster	163	(	13606	)	  Unincorporated - North Whittier	1121	(	13409	)	  Unincorporated - Northeast San Gabriel	1636	(	6806	)	  Unincorporated - Padua Hills	9	(	4186	)	  Unincorporated - Palmdale	111	(	13183	)	  Unincorporated - Palos Verdes Peninsula	23	(	3704	)	  Unincorporated - Pearblossom/Llano	129	(	6595	)	  Unincorporated - Pellissier Village	170	(	27464	)	  Unincorporated - Placerita Canyon	3	(	652	)	  Unincorporated - Pomona	61	(	3148	)	  Unincorporated - Quartz Hill	1230	(	9530	)	  Unincorporated - Rancho Dominguez	388	(	14581	)	  Unincorporated - Roosevelt	93	(	9989	)	  Unincorporated - Rosewood	165	(	12830	)	  Unincorporated - Rosewood/East Gardena	154	(	12909	)	  Unincorporated - Rosewood/West Rancho Dominguez	509	(	15144	)	  Unincorporated - Rowland Heights	3669	(	7191	)	  Unincorporated - San Clemente Island	0	(	0	)	  Unincorporated - San Francisquito Canyon/Bouquet Canyon	15	(	1748	)	  Unincorporated - San Jose Hills	3513	(	17373	)	  Unincorporated - San Pasqual	39	(	1916	)	  Unincorporated - Sand Canyon	17	(	5519	)	  Unincorporated - Santa Catalina Island	164	(	61423	)	  Unincorporated - Santa Monica Mountains*	721	(	3872	)	  Unincorporated - Saugus	132	(	85161	)	  Unincorporated - Saugus/Canyon Country	40	(	11236	)	  Unincorporated - South Antelope Valley	28	(	6154	)	  Unincorporated - South El Monte	348	(	19387	)	  Unincorporated - South San Gabriel	942	(	10646	)	  Unincorporated - South Whittier	8449	(	14267	)	  Unincorporated - Southeast Antelope Valley	79	(	10115	)	  Unincorporated - Stevenson Ranch	1182	(	5638	)	  Unincorporated - Sun Village	956	(	15838	)	  Unincorporated - Sunrise Village	195	(	15046	)	  Unincorporated - Twin Lakes/Oat Mountain	96	(	5790	)	  Unincorporated - Val Verde	339	(	10245	)	  Unincorporated - Valencia	200	(	6510	)	  Unincorporated - Valinda	3776	(	16157	)	  Unincorporated - View Park/Windsor Hills	710	(	6102	)	  Unincorporated - Walnut Park	3081	(	19086	)	  Unincorporated - West Antelope Valley	57	(	3772	)	  Unincorporated - West Carson	2280	(	10323	)	  Unincorporated - West Chatsworth	2	(	16667	)	  Unincorporated - West LA	234	(	24580	)	  Unincorporated - West Puente Valley	1726	(	17550	)	  Unincorporated - West Rancho Dominguez	201	(	14790	)	  Unincorporated - West Whittier/Los Nietos	4251	(	15788	)	  Unincorporated - Westfield/Academy Hills	44	(	3385	)	  Unincorporated - Westhills	42	(	5006	)	  Unincorporated - White Fence Farms	284	(	7711	)	  Unincorporated - Whittier	321	(	8483	)	  Unincorporated - Whittier Narrows	15	(	125000	)	  Unincorporated - Willowbrook	6130	(	17558	)	  Unincorporated - Wiseburn	521	(	8644	)	  -  Under Investigation	15358				    

 
These numbers are subject to change based on further investigation. 17 cases and 1 death previously reported were not in Public Health's jurisdiction.  * Means that case numbers include cases associated with correctional facility outbreaks located in the city/community.  **Rate is crude and is per 100,000. This represents the number of cases per 100,000 people and allows for the proportional comparison of cities of different sizes.    

Always check with trusted sources for the latest accurate information about novel coronavirus:       Los Angeles County Department of Public Health  California Department of Public Health  Centers for Disease Control and Prevention (CDC)   Spanish World Health Organization  LA County residents can also call 2-1-1   
  The Department of Public Health is committed to promoting   health equity and ensuring optimal health and well-being   for all 10 million residents of Los Angeles County.   Through a variety of programs, community partnerships and   services, Public Health oversees environmental health,   disease control, and community and family health.   Nationally accredited by the Public Health Accreditation   Board, the Los Angeles County Department of Public Health   comprises nearly 4,500 employees and has an annual budget   of $1.2 billion. To learn more about Los Angeles County   Public Health, please visit    , and follow LA County Public Health   on   social media at twitter.com/lacounty.gov, and follow LA County Public Health on   social   media at , ,  and . 


#####

  The best protection against COVID-19 is getting vaccinated. Public Health encourages those that are not vaccinated and are eligible to get vaccinated, to get vaccinated without delay.        
If you are not vaccinated and around people outside your household, your mask offers the next best protection against the virus. With distancing requirements and capacity limits lifted in almost all settings, wearing a mask is critically important for those not yet vaccinated, including the 1.2 million children between the ages of 2 and 12.         
""To the families and friends experiencing the sorrow of losing of a loved one due to COVID-19, we send our deepest condolences,” said Barbara Ferrer, PhD, MPH, MEd, Director of Public Health. “Last year, we didn’t have the vaccine and there were increases in cases and hospitalizations that occurred after the Fourth of July holiday.  This year we have three powerful vaccines but there are still about 4 million residents that are unvaccinated and at risk of COVID-19 infection. With small increases in community transmission and an increase in the circulation of the Delta variant, your best protection and the best protection for the County’s recovery are the safe and effective COVID-19 vaccines. And while we are increasing the number of people with vaccination protection, sensible public health precautions, including masking and hand hygiene can support our recovery.”        
People who are not fully vaccinated, including all children between the ages of 2 and 12, are required to wear masks at all indoor public settings and businesses. Because of increased circulation of the highly transmissible Delta variant across the country and to protect unvaccinated residents, Public Health strongly recommends everyone, as a precautionary measure, wear masks indoors in settings (such as grocery or retail stores theaters and family entertainment centers, and workplaces) when you don't know everyone's vaccination status.    

Through Thursday, July 1 at County-run vaccination sites, LA City sites, and St. John’s Well Child and Family Center sites, everyone 18 and older coming to get a vaccine will have an opportunity to win one of two packages, each containing season passes to Six Flags, the LA Zoo, the Natural History Museum and the La Brea Tar Pits, and ticket packs to the California Science Center. Official rules and participating site locations are posted online on the Los Angeles Vaccination Sweepstakes page. Winners will be contacted by phone and/or email.    
  Anyone 12 and older living or working in L.A. County can get vaccinated. COVID-19 vaccinations are available at County-run sites, LA City run sites, almost all mobile sites and many of the community sites without an appointment. Many sites are open on weekends and have evening hours.    
    Visit:   www.VaccinateLACounty.com (English) and  (Spanish) to find a vaccination site near you, to make an appointment at vaccination sites, and much more. If you don’t have internet access, can’t use a computer, or you’re over 65, you can call 1-833-540-0473 for help finding an appointment, connecting to free transportation to and from a vaccination site, or scheduling a home-visit if you are homebound.  Vaccinations are always free and open to eligible residents and workers regardless of immigration status.    
   COVID-19 Sector Protocols, Best Practices, COVID-19 Vaccine Dashboard, COVID-19 Surveillance Interactive Dashboard, Recovery Dashboard, and additional actions you can take to protect yourself, your family and your community are on the Public Health website  .     
Laboratory Confirmed Total Cases 1250240* 
Los Angeles County (excl. LB and Pas) 1185253  Long Beach  53650  Pasadena  11337 
Deaths	24483  Los Angeles County (excl. LB and Pas) 23189  Long Beach	945  Pasadena	349  
Age Group (Los Angeles County Cases Only-excl LB and Pas)  0 to 4:	29562  5 to 11:	56771  12 to 17:	70955  18 to 29:	280777  30 to 49:	393871  50 to 64:	228230  65 to 79:	91136  over 80:	33299   Under Investigation 652 
Gender (Los Angeles County Cases Only-excl LB and Pas)  Female: 	600964   Male:	561941  Other: 644  Under Investigation	21704 
Race/Ethnicity (Los Angeles County Cases Only-excl LB and Pas) American Indian/Alaska Native 2013  Asian:	56891  Black:	47716  Hispanic/Latino:	635182  Native Hawaiian/Pacific Islander: 4249  White:	131465  Other:	99127  Under Investigation: 208610 
Hospitalization  Hospitalized (Ever)	91097 
Deaths Race/Ethnicity (Los Angeles County Cases Only-excl LB and Pas) American Indian/Alaska Native	51  Asian	3163  Black	1919  Hispanic/Latino	12455  Native Hawaiian/Pacific Islander  67  White	5350  Other	152  Under Investigation	32 
