"Djokovic, Medvedev win US Open men's semis, head to Sunday's final - Fox News
 Beating No. 2 Daniil Medvedev on Sunday for the title will allow Djokovic to secure two significant milestones. He would add the 2021 U.S. Open trophy to those he won at the Australian Open in February, French Open in June and Wimbledon in July. And the 34-year-old from Serbia would collect his 21st Slam title in all, breaking the men’s career mark he currently shares with Roger Federer and Rafael Nadal.""There’s only one match left. ... All in. Let’s do it,"" Djokovic said, spreading his arms wide, in an on-court interview. ""I’m going to put my heart and my soul and my body and my head into that one. I'm going to treat the next match like it is the last match of my career.""That key game against Zverev featured one extended exchange after another, including a 53-shot, minute-plus point that was the longest of the tournament and actually was lost by Djokovic. Zverev delivered a forehand winner, then hunched over with his hands on his knees. Djokovic went to grab a towel. Both men were breathing heavily as most of Arthur Ashe Stadium's 21,139 spectators rose in unison on a cool, crisp evening.
      Novak Djokovic, of Serbia, reacts after defeating Alexander Zverev, of Germany, during the semifinals of the U.S. Open tennis championships, Friday, Sept. 10, 2021, in New York City. (Associated Press)
      But that one, tiny outcome didn't matter. Never seems to with Djokovic, especially in best-of-five-set matches on his sport's most prestigious stages. As usual, he used his superb returning and never-take-a-rest defense to wear down Zverev.""I’m proud of the fight that I delivered,"" Djokovic said.So, yes, Djokovic lost that point — which was preceded by others lasting 13, 19, 22 and 31 shots, and followed by one that went 16 — but he won that game, and that set with it. Just as he had lost the first set about 1 1/2 hours earlier but turned things around, with the help of a dip in level from the fourth-seeded Zverev. And just as, later, Djokovic lost the fourth set but immediately rebounded and was nearly untouchable while going ahead 5-0 in the fifth then held on.Djokovic, who has spent more weeks at No. 1 in the ATP rankings than anyone, figures out what is required to emerge on top and does it. In each of his past four matches — and 10 in all at the Slams this year — he trailed by a set and won.He equaled Federer by getting to a 31st career Slam final; Djokovic's total now includes a record nine in New York, where he has won three championships.It will be Slam final No. 3 for Medvedev, a 25-year-old from Russia, who eliminated 12th-seeded Felix Auger-Aliassime of Canada 6-4, 7-5, 6-2 in the afternoon. Medvedev was defeated by Djokovic in this year's Australian Open final and by Nadal in the 2019 U.S. Open final.""The more you lose something, the more you want to win it. The more you want to gain it and take it,"" said Medvedev, who has lost only one set over the past two weeks. ""I lost two finals. I want to win the third one.""Djokovic is trying to go 4 for 4 at the majors over the course of one season, something last done in men's tennis by Rod Laver 52 years ago. It was also done by Laver in 1962 and Don Budge in 1938. Three women have completed what's known as a true Grand Slam, most recently Steffi Graf in 1988. Serena Williams' attempt in 2015 ended at the U.S. Open with a semifinal loss to Roberta Vinci.""I’ll be giving it all I possibly got in the tank to win this match. I’m focusing on recovery, recalibrating all the systems, basically, for Sunday,"" Djokovic said. ""I’m not going to waste time or energy on anything that can just be a distraction and deplete me from the vital energy that I need.""
      Daniil Medvedev, of Russia, reacts after scoring a point against Felix Auger-Aliassime, of Canada, during the semifinals of the U.S. Open tennis championships, Friday, Sept. 10, 2021, in New York City. (Associated Press)
      As Friday night's semifinal began, the 81-year-old Laver was seated front and center behind a baseline in the President’s Box at Ashe.A year ago in New York, when fans were banned because of the coronavirus pandemic, Zverev came oh-so-close to collecting his first major, taking a two-set lead and getting within two points of a championship before frittering it all away and losing to Dominic Thiem in a fifth-set tiebreaker.Zverev came into Friday on a 16-match winning streak, a run that includes beating Djokovic in the Summer Games semifinals on July 30. That was in a best-of-three-sets format, though, which changes everything when it comes to Djokovic. He is now 36-10 in matches that go five sets.Here’s the thing about Djokovic, who occasionally rubbed his lower back with his left hand or hit his legs with his racket: Whatever the outward signs seem to say, he never stresses and he waits for the other guy to slip.""It’s kind of a hurricane, a tornado, of emotions that you're going through in a sequence of one set or even one point. You are by yourself on the court, so there is no escape,"" Djokovic said. ""You’ve got to find a way.""He usually does.""Mentally, in the most important moments,"" Zverev said after his 3 1/2-hour loss, ""I would rather play against anybody but him.""Against Zverev, things really came alive six games and 20 minutes in, thanks to a terrific 24-stroke point in which Djokovic tried a drop shot. Zverev got to it, replied at a seemingly impossible angle and — after Djokovic sprinted wide of the doubles alley and stretched to retrieve that, sneakers squeaking all the way — came up with a winner.The crowd went wild. Zverev raised his right hand and wagged his fingers: ""Louder!"" Soon enough, Djokovic was shaking a ball off his frame and into the seats, and the set was Zverev's.Zverev went from six unforced errors in that set to 13 in the second, and the match was even.In the third, some loose play by Djokovic, and a backhand passing winner by Zverev, created a pair of break points. But Djokovic saved them and held to 3-2 with a forehand that clipped the baseline.Zverev put a hand on his hip, disagreeing that the ball was in, but there is no recourse at the U.S. Open this year: All rulings come via electronic line-calling and can’t be disputed. There are no line judges to doubt or to argue with.Last year, there were, and Djokovic was disqualified from Flushing Meadows in the fourth round when a ball he hit after losing a game inadvertently struck a line judge in the throat. At the following major tournament, the pandemic-delayed French Open, Djokovic lost in the final to Nadal.Since then, there have been deficits in Grand Slam matches for Djokovic, but no defeats.""It’s great for the sport,"" Zverev said about Djokovic's pursuit. ""Nobody thought that anybody would do it again. ... I do believe that he will do it.""",https://a57.foxnews.com/cf-images.us-east-1.prod.boltdns.net/v1/static/694940094001/a6d2c06f-f57d-4b13-9f67-f0e95421e2fa/ee0d832a-668c-4a05-b43c-84e614a30c01/1280x720/match/931/524/image.jpg?ve=1&tl=1,"6 takeaways from Cam Newton's tell-all video following release from Patriots - Patriots Wire
Cam Newton is one of the most open and honest players to ever touch an NFL field.Whether the situation is positive or negative, he’s going to express himself. The 32-year-old made sure to vent following his release from the New England Patriots last week. Newton dropped a 43-minute video on Friday morning to discuss the past couple months with the Patriots, while being interviewed by his father, Cecil.Newton touched on topics ranging from his relationship with Mac Jones, the COVID situation that sidelined him for five days and his future in the NFL.Here’s some of the major takeaways from Newton’s tell-all video.Similar to everyone, Newton was surprised by the release.“Did it catch me by surprise, being released? Absolutely,” Newton said after being asked the question by his father.“I’ve been playing long enough to have got it remotely two years ago with the Panthers, but I never really got that call where, ‘Hey, come to the office,’ ” Newton said. “It was funny, as a matter of fact, to me. I’m laughing at it now. I walked in, and they were like, ‘Oh, hold up, Cam, Cam, Cam. Bill wants to meet with you.’ I’m like, ‘OK, cool.’ But Bill’s office is down here, and they were like, ‘No, he’s in here.’ And that’s when I’m like, ‘Oh, OK, I see what’s going on.’“When it happened, we went through the meeting, Matt Patricia was there, Bill was there. We greeted each other, and we just started talking. At that time, they told me that they were going to give the reins to Mac, and I was like, ‘OK, cool.’ And it didn’t dawn on me. I was like, ‘Y’all releasing me?’ I was confused, because Bill was — we all were shocked. It was uncomfortable for everybody.”The COVID situation that sidelined Newton for five days appeared to come out of nowhere. It also appeared to be framed as if it were Newton’s fault for being irresponsible ahead of the Patriots’ third preseason game.Here’s the Patriots’ statement on it.“On Saturday, Cam Newton traveled to a club-approved medical appointment that required him to leave the New England area,” the statement read. “He received daily COVID tests, which were all negative. Due to a misunderstanding about tests conducted away from NFL facilities, and as required by the NFL-NFLPA protocols, Cam will be subject to the five-day entry cadence process before returning to the facility. Cam will continue participating virtually in team activities and return to the club facility on Thursday, August 26.”Newton followed up with his side of the story.“Let’s go backwards to being away from the team for those five days: They gave me clearance to go,” Newton said, transcribed by WEEI. “So, I don’t want nobody to think they I just went. I’m owed a second opinion. That’s just a fact. The trip was necessary because this was the last time I felt that I was going to have an opportunity to get a second opinion.Not to say the personnel with the Patriots wasn’t coherent to telling me everything I needed to know, but having four eyes on it is better than having two eyes on it — in my opinion. It wasn’t that I was having any issues or pain, I just wanted to do a check-up with in essence the person who diagnosed me with the Lisfranc. I felt obligated to check back in with like a six-month review, or …“I crossed all the lines. I checked all the boxes. I dotted all my I’s and then to find out that I had to sit out, that’s when I kind of felt bamboozled because I’m like, ‘Y’all told me to go.’ It wasn’t like, ‘Cam, you know if you go you’re taking your own risk now.’ It was not that.” Despite what could be perceived to be bad blood between Newton and the Patriots, he still believes Jones will lead the team to wins. Newton didn’t seem to carry any resentment throughout the entire interview with his father.“They’re going to win football games with Mac Jones,” Newton said.His dad asked if the Patriots would win with Newton at the helm and he confidently responded.“That’s a fact, too,” he said. “But, I don’t want the audience to think he’s only saying that just because he’s not there no more. No, like Mac is good enough. I think when they selected him the selection that they picked him, they wanted to find out a couple of things. One of those things they wanted to find out was is he capable of leading this offense to be productive?”There was speculation stirring about his release saying a myriad of different scenarios caused it. Newton clearly believes that it was due to the fact that he’d be a distraction as Jones’ backup.“The reason that they released me was because indirectly, I was going to be a distraction without being the starter. … Just my aura. That’s my gift and my curse,” Newton said. “When you bring a Cam Newton into your facility, when you bring a Cam Newton to your franchise, people are interested by mere factor of who is he. Why does he wear his hair, why does he talk, why does he act, why does he perform? All these questions. …“So let me be honest with you. If they asked me, would I play behind — they say, ‘Cam, we’re going to give the team to Mac. You’re going to be the second string, and we expect you to be everything and some to guide him throughout this tenure.’ I would have said, ‘Absolutely.’ But listen, the truth of the matter is this: He would have been uncomfortable.”Rob Ninkovich went on a limb by . Newton had the entire 2020 season to learn it and Jones had his own growth to work through in five months since he was drafted.While being asked about it by his father, Newton replied with grace.“No,” Newton said. “How can he teach me?”He did admit the playbook was slightly different than anything he’s been used to, but that didn’t mean Jones was teaching him it.“Nah. If anything, I was — I was like, ‘Josh, it’s so new to me.’ I’ve never been in a system that required me to know where the Mike (linebacker) is, to know the front, to identify certain fronts and XYZ,” Newton said. “You can’t say that that’s stupid or ‘Why wouldn’t you know that?’ because half of the NFL — I would say 30 teams out of 32 teams don’t run this philosophy. It’s in the center’s call, because they control the protection, and if you have any type of red flag or an alert, then that’s when you kind of (say), ‘Whoa, whoa, whoa. Hey, Lucy this. Ricky to 50.’ You know what I’m saying? Something like that.“But as far as that? No. Mac was cool, man. He was a person who was young. He was still trying to find his way. And that’s why I would just say what can he teach me when it’s coming at him faster than it was coming at me? I would always ask Mac, and we were helping each other. It’s like, ‘You straight, bro?’ And I would go to (Brian Hoyer) and be like, ‘Bro, you seeing something that I didn’t see?’ or ‘What was the Mike?’ or XYZ. And then me and Josh had a great dialogue after practice or during practice where he would tell me. But I felt heads and toes above where I was understanding (the offense) 12 months ago. Without a doubt.”All this led to the question — is Newton going to retire at the age of 32?He prefaced the interview by saying it wasn’t a retirement speech and he backed that sentiment up at the end. Newton still believes there aren’t 32 quarterbacks better than him in the NFL.He is waiting for the right moment and won’t push the envelope, but there is still football in Newton’s future.“Do I have a lot of football left in me yet? Absolutely,” Newton finished the interview with. The Dolphins aren't a cupcake matchup for the Patriots in Week 1.If the Patriots want a successful season, these guys need to perform.Start every day with our most popular content waiting in your inbox.",https://patriotswire.usatoday.com/wp-content/uploads/sites/71/2020/12/USATSI_15340138.jpg?w=100&h=60&crop=1,"Jaylon Smith, Leighton Vander Esch were odd linebackers out for Cowboys - NBC Sports
The Buccaneers ran 64 plays Thursday night. The Cowboys gave their five linebackers 131 snaps, but they weren’t evenly distributed.Rookie Micah Parsons was on the field for 51 snaps, and free agent signee Keanu Neal played 50.That didn’t leave many snaps for anyone else, with Parsons and Neal serving as the primary nickel linebackers.Jaylon Smith played 16 and Leighton Vander Esch 14. Jabril Cox didn’t see action on defense.“I think they understand if you look at the big picture,” coach Mike McCarthy said of Smith and Vander Esch, via Mark Lane of WFAA. “We took 24 defensive players into the game. We had projections of how we wanted to play guys, and we knew it was going to be a challenge with the climate and the humidity. I think we really hit the target as far as getting the distribution of playing all the guys on defense. So, yeah, personally, I can’t speak on their behalf. If they weren’t frustrated, I’d be disappointed. These guys have played a lot of football throughout their whole career. It’s our focus to be better as a whole as a defense and frankly the more players you play, the better off you’re going to be.”Smith, a former second-round choice who counts $9.8 million against the cap this season, played 97.8 percent of the team’s defensive snaps last season. Vander Esch, a former first-round choice who is making $3.77 million in the final year of his deal, played only 10 games last season. Still, he played 42 percent of the defensive snaps for the season.Both players could get a fresh start somewhere else next season. The Cowboys declined Vander Esch’s fifth-year option. Smith has no guaranteed money left on his deal and is scheduled to count $11.8 million against the 2022 cap.Parsons, the team’s first-round choice this spring, is the big man on campus now. He totaled seven tackles, a pass breakup and a quarterback hit against the Bucs.“I thought it was a good start for him,” McCarthy said. “I think he’s beyond his years. He’s still a rookie. It was the first time he played in an NFL game and also the communication responsibility he has to handle. That’s a new experience. I don’t care where you played or how much time you get in the preseason. I thought he got off to a good start.”",https://profootballtalk.nbcsports.com/wp-content/uploads/sites/25/2021/09/GettyImages-1183049758-e1631325439543.jpg?w=560&h=286&crop=1,"Fantasy Football Rankings Week 1, 2021: Model that beat experts says start Trevor Lawrence, sit Justin Herbert - CBSSports.com
When it comes to setting your Week 1 Fantasy football lineups, the decision to start a rookie quarterback in his first real NFL action can be a dicey one. Joe Burrow finished as the 20th quarterback in the first start of his pro career, while Justin Herbert was 13th when he debuted in Week 2 a season ago. A reliable set of Week 1 Fantasy football rankings can help to make the call on whether to start a young gun over a veteran passer.This week, four rookie quarterbacks are likely to make their debuts. Will Mac Jones shine as the top dog in New England, and can you trust him in your Fantasy football QB rankings? How viable of a threat is Trey Lance as a fantasy option in San Francisco? Before you lock in your lineups, be sure to .When it comes to ranking players, SportsLine's model beat human experts in Fantasy football for the past several seasons especially when there were big difference in ranking. Over the course of a season, that could literally be the difference between winning your league or going home empty-handed.Last year, the model accurately predicted that Bills quarterback Josh Allen was being drastically undervalued. His Fantasy football ADP was barely in the top 70, but the model pegged him as a top-five Fantasy quarterback, a QB1 who would finish well ahead of players like Kyler Murray, Tom Brady and Drew Brees. Allen ended up being the No. 2-scoring Fantasy QB, outscoring all three of those other quarterbacks and even surpassing Patrick Mahomes. Fantasy players who followed SportsLine's advice reaped plenty of value with that pick. Now, the model, which simulates every NFL game 10,000 times, has revealed its Fantasy football rankings for Week 1 of the 2021 NFL season. .One player the model is extremely high on this week: Jaguars quarterback Trevor Lawrence. The top prospect in years is up against a Houston Texans side that many presume will be the league's worst team in 2021. After mixed results in his first two preseason games, he torched the Dallas Cowboys, completing 11 of his 12 passes for 139 yards and two touchdowns.Houston traded starting cornerback Bradley Roby to the New Orleans Saints. Meanwhile, three defensive starters in Houston's front seven were all limited in practice this week. Lawrence has ascended to fifth in SportsLine's Week 1 Fantasy football quarterback rankings and is poised to throw darts all over the field against the Texans.A massive shocker: Chargers quarterback Justin Herbert, who threw for 4,336 yards and 31 touchdowns last season, stumbles big-time and barely cracks the top 15 at his position. Herbert had an impressive rookie season, averaging 25.5 Fantasy points per game. However, Herbert could be dealing with rust after not playing in the preseason and a matchup against the Washington Football Team won't do him any favors.Washington's defense gave up just 191.8 passing yards per game last season, which ranked second in the NFL. In addition, Washington recorded 47 total sacks in 2020. With such a tough matchup on Sunday, Herbert is a player to consider putting on the bench in Week 1.The model is also calling for a surprising quarterback you aren't even thinking about to finish in the top 10 of its Fantasy football rankings. This pick could be the difference between winning big and going home with nothing. .So who should you start and sit this week? And which surprising quarterback could lead you to victory? .",https://sportshub.cbsistatic.com/i/r/2021/06/14/daf34ee4-2b1e-4814-b552-c230236ceb6c/thumbnail/140x140/8f830c708a4c24afd182432bc32f24d5/trevor-lawrence-1400.jpg
