"Football: Italian fans must not travel to UK for Euro final, says British minister - CNA
LONDON: British transport minister Grant Shapps has told Italian football fans not to try to travel to England for the final of this year's Euro 2020 tournament on Sunday (Jul 11). England face Italy on Sunday in the final at London's Wembley Stadium, where crowds of around 60,000 people are expected but few of them will be Italians as Britain's travel rules require arrivals from there to quarantine for 10 days.Asked on Friday what he would say to Italian fans trying to get to the game, Shapps said: ""'Don't' is the answer to that simple question.""""If we detect people are coming in just for the football, they won't be allowed in and in fact, lots of charter flights and direct flights have been cancelled on that basis,"" he told Times Radio.",https://annaadarsh.edu.in/wp-content/uploads/2021/04/sport.png,"Kasper Schmeichel had laser pen shone at his face as Harry Kane stepped up for England penalty - Yahoo Singapore News
Denmark goalkeeper Kasper Schmeichel had a laser pen shone at his face as Harry Kane stepped up for England's penalty in their Euro 2020 semi final clash.ITV showed footage of a green laser flashing across Schmeichel’s face as he prepared to face Kane’s extra-time penalty at Wembley on Wednesday night.The goalkeeper did not appear to be aware of the attempted distraction and saved the penalty, before Kane tucked away the rebound to score what would be the winning goal.ITV presenter Mark Pougatch condemned the unknown perpetrator.He said: “One thing we have spotted just as Harry Kane took the penalty and which is completely unacceptable and ridiculous…look, someone’s got a laser pen in the stands.“Whoever they are they’re an idiot, him or her, and we can just hope that it didn’t put Kasper Schmeichel off because it’s stupid and he doesn’t deserve that.“That sort of thing, nobody wants to see.”Further controversy surrounded the penalty–which ultimately sent England into their first final since 1966–Raheem Sterling was accused of diving to win the spot kick, which came in the first half of extra time.There was also a second ball on the pitch when Sterling received the ball at the start of the move. Referees normally stop play in accordance with the laws of the game if there are two balls on the field.They can use their discretion and ignore it if the ball is not interfering with play, but on this occasion the stray ball was in the vicinity of Sterling and the Denmark defenders and could conceivably be said to be causing a distraction.Watch: This is how England fans in London celebrated when the Three Lions scored...Read More",https://s.yimg.com/ny/api/res/1.2/1BgPpqBsS90ev_.pawN.HA--/YXBwaWQ9aGlnaGxhbmRlcjt3PTk2MDtoPTcyMA--/https://s.yimg.com/uu/api/res/1.2/.9j6rTLlULUQJLVwhq3pWg--~B/aD0xNTM2O3c9MjA0ODthcHBpZD15dGFjaHlvbg--/https://media.zenfs.com/en/evening_standard_239/f1860676a6e99b9e26de6da12b884b28,"Vietnam SEA Games postponed to 2022 over Covid-19 concerns - The Straits Times
SINGAPORE – The Nov 21-Dec 2 South-east Asian Games in Vietnam have been postponed to next year, drawing mixed reactions from the Singapore sports fraternity. After the SEA Games Federation working committee met yesterday, the Singapore National Olympic Council (SNOC) issued a statement saying “it was decided that the SEA Games will not be held this year”.It added: “The Vietnam NOC will explore new dates for consideration. The SNOC will adjust the selection policy accordingly to reflect the new dates once the details are confirmed”.This confirms earlier speculation that the Hanoi Games would be rescheduled as the Vietnam Olympic Committee (VOC) had flagged concerns over the viability of staging it this year with the . The 40-sport meet was set to feature over 10,000 athletes, coaches and other participants.Vietnam, which last hosted the Games in 2003, has set aside a budget of US$69 million (S$91.3 million) to stage the competition. While it was reported to have introduced a “no vaccine, no participation” policy for the event, the number of cases in the country has increased by almost 10 times since March to more than 23,000.Vietnamese news publication Phap Luat Online reported last month that the VOC had sent a letter to its regional counterparts proposing the postponement of this year’s edition to July next year “due to the complicated situation of the Covid-19 pandemic”.But ESPN reported that a majority of the national Olympic committees, including Singapore’s, had “voted against” the proposal to move the event to July.The date is problematic for countries like Singapore and Malaysia as the higher-profile Commonwealth Games in Birmingham are set for July 28-Aug 8, and next year’s sporting calendar is also packed with other major multi-sport events including the Winter Olympics in Beijing (February) and Asian Games in Hangzhou (September).Varin Tansuphasiri, Games Council member and deputy secretary of the Thai Olympic Committee told AFP yesterday that Vietnam is proposing April or May next year as an alternative date. Singapore table tennis player Clarence Chew, who won a men’s singles silver in 2019, was disappointed to hear about the postponement but said that “the safety of the athletes, officials, spectators should be number one priority”. He added: “Next year, we will face a challenging year as we not only have to prepare for the Commonwealth Games and Asian Games but also the SEA Games. But I believe, as athletes, we are able to cope with the challenges and create positive outcomes.”Singapore swimming’s national training centre head coach Gary Tan shared that their training regimen will be tweaked to adapt to the delay, and there will be discussions with the SNOC on the qualifying time frames to ensure they have the best team for all three Games.He said: “Periodisation has to be spot on due to the fact we have multiple Games coming up. Picking the team will also be crucial, where we need to discuss internally to understand what are our key meets, who are our key personnel based off qualification, and decide how we can peak at the respective meets.”However, national bowler New Hui Fen, who won three gold medals at the 2019 SEA Games in the Philippines, called the news a “blessing in disguise” as this year’s edition would have clashed with the Nov 6-14 World Championships.She said: “With the current Covid-19 situation, there have been many changes in our daily lives. Adapting to changes, in a way, stretched my comfort zones wider. Now that the SEA Games is postponed, there is a possibility I can compete in both the World Championships and SEA Games. “Hopefully the SEA Games can be held safely in 2022 and be close to pre-Covid days where spectators are allowed.”",https://static.straitstimes.com.sg/s3fs-public/styles/article_pictrure_780x520_/public/articles/2021/07/08/eb-seagames-070821_2x.jpg?itok=25w3UsP-&timestamp=1625734647,"Ramos had blunt Arsenal snub reason, despite offer smashing PSG deal - Teamtalk.com
Sergio Ramos snubbed serious interest from Arsenal and Manchester City in favour of a transfer to Paris Saint-Germain, according to a report.The 35-year-old made headlines earlier this year . After 671 games and over 100 goals, he became a free agent despite his club’s best efforts to keep him. As such, the race began to snap up the legendary Spain international, who had initial links with a move to Manchester United.While Paris Saint-Germain won the race for Ramos, though, Goal claims that he could still have moved to the Premier League.Indeed, Arsenal and City both tabled lucrative contract offers for the centre-back.The Gunners offered him £15million per season on a two-year contract. Ramos has signed a two-year deal at PSG, but will take home £13million each campaign.Despite offering more, the defender rejected Arsenal because they do not feature in next season’s Champions League.Ramos has made a career out of leading his club to Europe’s top trophy. Consequently, he wanted to continue that legacy in the French capital.In fact, the allure of potentially winning PSG’s first Champions League would also have proved a key factor.Arsenal have , though, and have reportedly agreed personal terms.Premier League champions City feature in Europe’s premier competition. Like PSG and Arsenal, they put a two-year contract on the table for Ramos.Still, Ramos could not turn down a move to France.Ramos will also be looking to get back into the Spain team after being left out for Euro 2020. He did, though, face a battle with injury last season and  against Liverpool and Chelsea.Taking to social media after his move was confirmed on Thursday, Ramos hailed his eventual choice.“The best place to keep on dreaming, the best club to keep on winning,” he wrote on Twitter.“We’re going to fight with everything we have for everything.”",https://d3vlf99qeg6bpx.cloudfront.net/content/uploads/2021/06/17082108/Sergio-Ramos-1.jpg
"Grab CEO Anthony Tan's family grabs Bin Tong Park good class bungalow for $40m - The Straits Times
SINGAPORE - The family of Grab co-founder and chief executive Anthony Tan has bought a freehold property in the Bin Tong Park Good Class Bungalow (GCB) area for $40 million.Mr Tan's wife, Chloe Tong, bought the home from a doctor, according to media reports. A title search names the seller as Lau Chee Chong.",https://static.straitstimes.com.sg/s3fs-public/styles/article_pictrure_780x520_/public/articles/2021/07/09/yq-gcb-09072021.jpg?itok=I5gcIB8Z&timestamp=1625833930,"Salary dispute claims fell in 2020 despite economic downturn, COVID-19 restrictions - CNA
SINGAPORE: Despite an economic downturn, the incidence of salary claims made by workers last year declined, driven largely by a fall in claims made by foreign employees.The total incidence of salary claims in 2020 fell to 2.15 per 1,000 employees, down from , according to the Employment Standards Report 2020 released on Friday (Jul 9).The figure crept up for local workers to 1.61 per 1,000 local employees in 2020, compared to 1.53 in 2019. This was higher in industries such as accommodation and food services activities, information and communications, and construction, some of which were severely impacted by the ""circuit breaker"" and movement restrictions in 2020, said the Ministry of Manpower (MOM) and the Tripartite Alliance for Dispute Management (TADM) in the report.For foreign workers, there were 3.47 salary claims per 1,000 foreign employees, compared to 4.98 in 2019. The industries with the highest incidence of salary claims were arts, entertainment and recreation, accommodation and food services activities, as well as construction. Disputes over basic salaries made up most of the claims but the agencies noted that the proportion of claims relating to end of employment issues, such as salary in-lieu of notice and encashment of unconsumed annual leave increased in 2020.This was due to disagreements on whether leave had been taken during the circuit breaker and if salaries were owed during the period of business disruption.The report said that for foreign workers, the fall in claims was mainly because authorities had taken steps to address potential disputes due to the impact of COVID-19 on businesses.When dormitories went into lockdown around April 2020, MOM introduced a requirement for all employers with workers living in dormitories to pay salaries electronically. From May last year, all employers in the construction sector, which traditionally accounted for a high percentage of salary non-payment cases, had to submit monthly declarations on the status of salary payment to their foreign employees.In June last year, MOM introduced a module on a mobile application for migrant workers so that they can report any salary, bank account and remittance issues.For owed salaries, TADM actively engaged employers and facilitated salary resolution for about 7,000 migrant workers between June and December 2020, without requiring employees to come forward to lodge these salary claims.“As a result, salary issues did not feature prominently in the management of COVID-19 at the dormitories,” said the report.Senior Minister of State for Manpower Koh Poh Koon said in a Facebook post that despite the weakened economic conditions, Singapore’s employment standards remained stable last year. ""Employers and employees had worked together and made mutual sacrifices to sustain businesses and preserve jobs,"" he wrote.Mr Kandhavel Periyasamy, TADM general manager noted that the incidence of salary claims among local employees increased slightly, especially in industries more affected by the circuit breaker and movement restrictions. ""We will watch this trend closely and adapt our interventions and strategies accordingly,” he said.MORE THAN 9 IN 10 WORKERS REPAIDFor all workers, MOM had in March 2020 introduced a requirement for employers with 10 or more employees to notify the ministry of any cost-saving measures that affect employees' monthly salaries. The Tripartite Alliance for Fair and Progressive Employment Practices (TAFEP) then proactively engaged employers who had made severe pay cuts to check whether the cost-saving measures were implemented fairly, the report said.TAFEP persuaded employers to “exercise compassion in supporting their employees”, it added.The median duration of salary arrears claimed by foreign workers also fell to 2.3 months, compared to 3.4 months in 2019. This indicates that they are reporting lapses in salary payments earlier. For local employees, the median duration was 1.1 months in 2020.The total recovered sum to employees amounted to about S$15 million and more than nine in 10 employees (92 per cent) who filed claims fully recovered their salaries, said the report.Of the remaining 8 per cent of employees, 5 percentage points recovered their salaries partially. Most of these claims involved employers who were unable to make full payment for their workers’ owed salaries due to financial difficulties. MOM and TADM helped the affected workers recover part of their salary arrears through other means, such as by negotiating for settlement payments from security bond insurers or main contractors, or helping lower-wage employees get help through the Short-Term Relief Fund (STRF) or Migrant Workers’ Assistance Fund (MWAF).“The remaining employees did not recover any salaries and were mainly higher income earners who did not qualify for financial relief through the STRF or MWAF,” the report noted.MOM suspended the work pass privileges of all employers who did not fully repay their employees. It added that less than 1 per cent of the salary claims lodged in 2020 involved ""wilful employers"" who refused to make full payment of the salary arrears despite having the means to do so. MOM said it investigates these employers with a view of prosecuting them.MOST WRONGFUL DISMISSAL CLAIMS “UNSUBSTANTIATED”The overall incidence of wrongful dismissal claims remained low at 0.39 claims per 1,000 employees, the agencies said.While it spiked in the second quarter of 2020, the incidence of such claims “stabilised” in the last two quarters of 2020. Many of the dismissal claims in the second quarter of 2020 were lodged by employees who were terminated abruptly, due in part to the restrictions in face-to-face meetings during the circuit breaker. However, most of these employers had fulfilled their contractual obligations, said the report.Of the wrongful dismissal claims assessed by TADM, about three-quarters (74 per cent) were found to be unsubstantiated, the report said. “Many of these claims had arisen from disputes over work performance, poor communication between the employer and employee or business restructuring due to the lacklustre economy,"" it added.For such claims, TADM will explain to the employees the lack of basis for their claims, help them seek closure to their grievances, and refer them to financial assistance programmes such as the COVID-19 Recovery Grant or job facilitation support where applicable.For the 26 per cent of claims that were substantiated, TADM will require the employer to address the claims, such as by compensating the employee, clearing up any miscommunication and/or facilitating the employee’s job search.Seventy per cent of wrongful dismissal claims lodged in 2020 were concluded at TADM within two months, it said, with the remaining complex claims ""generally concluding"" between two and six months.ONLINE OUTREACHDispute resolution was mainly carried out online last year due to the pandemic, and more than 600 cases per month were handled on the Online Dispute Resolution (ODR) platform. Parties could use email, WhatsApp Business messages, and online conferencing platforms to discuss and settle their disputes, said the report.In the next phases of development, TADM said it will focus on enhancing the usability of the system to cater to different users' profile and improve their access to relevant material, and explore the use of artificial intelligence and scenario-based conversations to guide users in their decision-making.More than three-quarters (76 per cent) of salary claims were resolved at TADM within two months, while complex claims were ""generally concluded"" between two and six months. The cases that took longer usually required further fact-finding when parties presented conflicting accounts or evidence. The proportion of salary claims concluded within two months decreased in 2020 partly due to the weak economic climate which made it more difficult for parties to agree on the payment terms, the report said.",https://www.incimages.com/uploaded_files/image/1920x1080/shutterstock_1145284904_372957.jpg,"Countries using Chinese, AstraZeneca Covid-19 shots increasingly eye boosters - The Straits Times
NEW YORK (BLOOMBERG) - Growing concern that Covid-19 vaccines being deployed across much of the developing world aren't capable of thwarting the Delta variant is prompting some countries to look at offering third doses to bolster immunity against more-infectious virus strains.Though definitive evidence is yet to emerge backing the need for so-called ""booster"" shots, health officials from Thailand to Bahrain and the United Arab Emirates have already decided to offer the extra doses to some people already inoculated with vaccines from Chinese makers Sinovac Biotech Ltd, Sinopharm and from AstraZeneca Plc.Officials are being motivated by concerns that Delta and other variants appear to be breaking down defences of vaccines not made from the super-effective messenger RNA technology, or mRNA.In places like Mongolia and the UAE, high levels of coverage with Chinese shots using the older, less effective inactivated vaccine platform hasn't stopped a surge in cases. In the Seychelles, five people Research shows that the Delta mutation is powerful enough to bringing down protection to below 90 per cent.The effectiveness of AstraZeneca's viral vector vaccine against symptomatic infections caused by the variant was lower at 60 per cent, a study showed, though it can still prevent more than 90 per cent of hospitalisations.Countries are hoping a booster - either mRNA or a dose of another shot previously taken - could bolster protection ahead of the return of colder weather that's optimal for the virus's spread.Unlike western developers, Sinovac and Sinopharm have shared little about how their vaccines could protect against variants.Dr Shao Yiming, a researcher with the Chinese Centre for Disease Control and Prevention, said in May that preliminary studies indicated Chinese vaccines were still protective against variants emerging from India, without elaborating.The two inactivated vaccines produced by Sinopharm were 73 per cent and 78 per cent effective against symptomatic Covid in phase III trials.Various results from Sinovac's clinical trials across Brazil, Indonesia and Turkey put efficacy at a wide range of 50 per cent to over 80 per cent, which has fuelled uncertainty about how well it works.""We recognise that the weaker vaccines in particular seem to lose their ability to protect against Covid-19 relatively quickly, particularly against the variant strains,"" said Professor Nikolai Petrovsky from the College of Medicine and Public Health at Australia's Flinders University. ""Even the better vaccines seem to be showing increasing levels of vaccine failure due to variant infections.""Yet any plans by wealthier nations to acquire additional shots stands to further strain global supply and exacerbate the inequality gap that has left poor countries with fewer inoculations.The  to help meet a goal of vaccinating at least 40 per cent % of every country's population by the end of the year. Global deaths passed 4 million this week, as the disparity leaves poorer places exposed to outbreaks.Giving extra doses ""could easily divert one to two billion doses of vaccines over the coming 12 months to boost people already immunised that might otherwise go to developing countries where people have yet to receive their first immunisation,"" Prof Petrovsky said.Pfizer Inc. CEO Albert Bourla tweeted Thursday that the company believes a booster dose ""will likely be necessary to maintain highest levels of protection"" against Covid, with initial data from its booster study demonstrating that the added dose was eliciting five-to-10 fold higher antibody response.The drugmaker plans to request US emergency authorisation in August for a third booster dose of its shot, based on early data showing it can increase immune protection from Covid.The WHO has expressed caution in encouraging third doses. Chief scientist Soumya Swaminathan said in June that such a recommendation was unnecessary and premature given the paucity of data on booster shots and the fact that high-risk individuals in much of the world still haven't been fully vaccinated.But governments are racing ahead as the Delta variant spreads to more than 100 countries after devastating India, where it was first identified. The concern is particularly acute in places which had earlier relied on Chinese vaccines, which are available in nearly 100 nations.In the Middle East, some countries have already started offering booster shots - including Pfizer and Sinopharm - for people who completed their vaccinations months ago, mostly with Sinopharm.Thailand plans to use vaccines from AstraZeneca and Pfizer as boosters for healthcare workers who earlier received Sinovac shots. The Indonesian Doctors Association this week also called for booster shots for health workers, after some medical staffers died despite being fully inoculated with Sinovac and AstraZeneca.Preliminary studies from Thailand show that a first dose of Sinovac followed by an AstraZeneca shot three to four weeks later can elicit a stronger immune response than two doses of the Sinovac vaccine.Even China, which has fully immunised more than a third of its 1.4 billion people with homegrown vaccines, has a study underway to evaluate the benefit of booster shots.Sinovac CEO Yin Weidong has said a third shot of the company's vaccine, given three to six months after full inoculation, could raise antibody levels by as much as 20 times.China is currently reviewing the BioNTech vaccine for approval. A few options are being considered by officials, including using it a booster shot for people already fully inoculated with local vaccines, according to people familiar with the matter, asking not to be named as the talks are not public.No decision has been made, and adding the mRNA shot as another option in China's general rollout is also being discussed, the people said.""If you can explore different combinations, there frequently is a combination where you get a better outcome than just using the same vaccine twice in a row,"" said Prof Shane Crotty from the Centre for Infectious Disease and Vaccine Research at California's La Jolla Institute for Immunology. ""I do think that'll happen for Covid vaccines.""",https://static.straitstimes.com.sg/s3fs-public/styles/article_pictrure_780x520_/public/articles/2021/07/09/nz_astrazeneca_090734.jpg?itok=aqiLVeMp&timestamp=1625784328
