
"Largest E-sports Experience Centre here opens, Sport News & Top Stories - The Straits Times
In another sign of the growing importance of Singapore's e-sports scene, the industry will now have a place to call home.The largest E-sports Experience Centre (EXP) was opened at the Singapore Sports Hub yesterday by Minister for Culture, Community and Youth Edwin Tong.The EXP is set up by Singapore-based company Esports Entertainment Asia (EEA).The 12,000 sq ft facility located at Kallang Wave Mall houses a comprehensive e-sports ecosystem under one roof. It features an integrated live-streaming-ready e-sports event space, pro-e-sports team rooms, e-sports cafe and open-concept LAN gaming area.It also offers a comprehensive display of sound and video equipment, gaming laptops and consoles, as well as the latest gaming accessories and gadgets from top brands in the industry.It will complement the Sports Hub's partnership with Singapore Cybersports and Online Gaming Association, which supports a host of e-sports programmes focused on the community, outreach, education and elite training, along with industry and pathway development.Sports Hub chief executive Lionel Yeo said the facility showed its commitment to cultivating e-sports here as one that is ""a healthy, positive sporting and entertainment activity for Singapore youths"".He added: ""We are also excited to welcome EXP as a new public offering which will provide a focal point for e-sports enthusiasts, pro-gamers and brands to come together.""The Sports Hub has hosted several local and international e-sports activities and competitions in recent years like Hyperplay, an Asean e-sports and music festival organised by the Ministry of Culture, Community and Youth in 2018. A year later, it staged One E-sports' Dota 2 Singapore World Pro Invitational - the largest Dota 2 tournament in the region - which featured the top 12 teams from around the world.E-sports player Kenny Cheng, 22, from Team KopiForYou, who has participated in several Mobile Legends: Bang Bang (MLBB) competitions said he was pleased to know that there is now a central hub for e-sports players.He noted: ""It's great news especially because such a facility being set up does show that e-sports is growing and perhaps this will allow the sport to be better recognised by our locals, due to the investment being made.It's great news especially because such a facility being set up does show that e-sports is growing... I am amazed at how the e-sports community continues to grow and facilities like this can help to made a huge difference in the future for the industry.""I am amazed at how the e-sports community continues to grow and facilities like this can help to made a huge difference in the future for the industry.""",https://static.straitstimes.com.sg/s3fs-public/styles/article_pictrure_780x520_/public/articles/2021/07/09/st_20210709_dghub09_66798962.jpg?itok=VUv7NNlk&timestamp=1625778452,"This application could help protect young eyes from the effects of screens - Yahoo Singapore News
The pandemic and its consequences have led to all of us spending more time in front of screens. Whether it is adults or children, the risks of vision problems have increased. That's why Highlab has created Eyes Keeper, an application to protect your eyes from screens.Highlab, a French studio specialized in the design and production of digital devices, has rolled out its Eyes Keeper tool to allow parents to better control their children's environment. Eyes Keeper forces the device user to maintain a suitable distance when looking at a screen thanks to a detection system. If the user does not respect the necessary distance, the application will blur the image until there's a reasonable minimum of space between the user and the smartphone or tablet. Early, excessive exposure to screens Spending too much time looking at screens is harmful for the eyes. Accumulated screentime can cause visual fatigue, dry eyes or even promote the development of myopia. These are among the reasons why massive use of screens and the increasing number of devices piling up in our homes has long worried the health world. For many users, screentime has gotten out of hand and our relationship to our devices is one of addiction, causing sleep deficits, anxiety, attention disorders, memory problems and more.Doctors call this new syndrome EEES for ""early and excessive exposure to screens."" The creators of Eyes Keeper want to help device users create better defenses against these issues, allowing parents for example to choose which applications can be used according to a certain time slot. The aim is to ultimately help families avoid these increasingly frequent vision problems.The application is available on the Google Store, priced at €3.99.Axel Barre",https://s.yimg.com/ny/api/res/1.2/eexo.TsodGJazctHJ2Gjhw--/YXBwaWQ9aGlnaGxhbmRlcjt3PTk2MDtoPTY3Mi42MjkyNzg5NTEyMDE3/https://s.yimg.com/uu/api/res/1.2/80jQBIUoVAs.LgNdgg1U.A--~B/aD0xOTI0O3c9Mjc0NjthcHBpZD15dGFjaHlvbg--/https://media.zenfs.com/en/afprelaxnews.com/15cb44f5788c3f849ec18411010e08d2,"Redesigned Microsoft Office for Windows is now available for Insiders - Techradar
While Microsoft is trying to fix the compatibility issues on the newly announced Windows 11, the company is also looking to introduce a new user interface for its Office applications.Though the fresh look was supposed to launch last week, the Redmond based tech company has announced that the Beta version of the updated interface is now available for insiders to download on both Windows 11 and Windows 10.According to the official blog post by Microsoft, the new Microsoft Office carries the same fluent design language that we’ve come across on Windows 11. The company states that it has been working on the redesign since 2017.Microsoft is promising a simple, natural and consistent design experience with all your Windows apps  This MS Office update will bring the refreshed look seen in Windows 11 to applications like Word, Excel, PowerPoint, OneNote, Outlook, Access, Project, Publisher, and Visio.Additionally, users who like customizing the look and theming on their systems will be able to set the separate theme for Windows and Office apps. This can be done by choosing the theme of your choice from the Office Account tab under the file menu. In case you want to have matching themes on both Office and Windows 11 for a consistent experience, you can select “Use system settings.”While Microsoft wanted to do away with the ribbon bar in favour of a command bar, however, the ribbon bar retains its place in this update. Also, while the current update majorly has design tweaks, the company promises more tweaks in the weeks and months leading to the final release.Want to know about the latest happenings in tech? Follow TechRadar India on Twitter, Facebook and InstagramJitendra has been working in the Internet Industry for the last 7 years now and has written about a wide range of topics including gadgets, smartphones, reviews, games, software, apps, deep tech, AI, and consumer electronics.  Thank you for signing up to TechRadar. You will receive a verification email shortly.There was a problem. Please refresh the page and try again.", https://www.verdict.co.uk/wp-content/uploads/2021/04/shutterstock_1583248045.jpg,"Tired of your TV's energy bill? Samsung Mini LED TVs are 11% more efficient - TechRadar
New Samsung TVs with Mini LED backlights could be as much as 11.6% more efficient than your current TV.That's what Samsung is claiming for its 2021 range of Neo QLED screens, all of which pack in enhanced backlights with greater energy efficiency than previous Samsung screens.Mini LED technology makes use of light-emitting diodes that are 1/40th of the sizes of traditional LEDs, allowing for far more precise brightness control. This means that the overall brightness of the screen can be lower, without lighting up pixels that don't need the extra visibility. Samsung claims that energy consumption is reduced by ""about a quarter"" (so, 25%) through a combination of improved backlights and optimized power supply boards too – while the slim nature of Mini LEDs means that its screens are even more compact and resource-light than before. Samsung also introduced a new solar-powered TV remote for its 2021 QLED range, doing away with disposable batteries for good.Of course, we wouldn't necessarily advise you to chuck your current television to get this more efficient one right away. Throwing away a TV can be damaging to the environment in itself, if not properly recycled, and it can cause waste to make upgrades before an older model has really run its course.But if you need to upgrade your old LCD, and are looking for a model that won't take such a toll on your energy bills, a Neo QLED / Mini LED model should certainly fare better. The only other thing to consider is whether an OLED might be better...TV makers are increasingly laying out their green credentials these days, and in a consumer tech market prone to wastage, a move towards sustainable practices can't come soon enough.LG has laid out some attractive figures for OLED TV recycling, showing that OLED panels for 65-inch TVs require a mere 0.43kg of plastic, compared to the 5.2kg of plastic utilized in a 65-inch LCD. That's 12 times as much plastic in an LCD screen – and it's not plastic that's easily recyclable, either, given the complexity of the material (via Business Korea).OLED TVs fare much better when it comes to power usage too. Due to the self-emissive nature of OLED panels, they don't require the backlight systems of LCD and QLED screens, and use a fraction of the amount of energy.In 2017, SGS also praised LG's reduction of ""hazardous substances"" in OLED TV manufacturing compared to LCD, as well as the ability of a ""self-luminous display [...] that used less parts and attained greater resource efficiency and recycle rates.""Samsung made some noise in 2020 around 'Eco-packaging' for select new Samsung TVs, made from ""eco-friendly corrugated cardboard"" that can be repurposed into a pet kennel or magazine rack, alongside moves to replace metal staples with glue and utilise more recycled plastic in its packaging. However, the aggregate wastage of plastic-heavy LCD TVs may be more than these green measures can counteract by themselves.As Home Cinema Editor, Henry lives and breathes televisions, which is bad for the lungs but great for his content addiction. He also reports on VR, video games, smart speakers, and home entertainment.Thank you for signing up to TechRadar. You will receive a verification email shortly.There was a problem. Please refresh the page and try again.",https://cdn.mos.cms.futurecdn.net/Gnzd4GiTzJv8TDrWeDT4rG-320-80.jpg,"Microsoft Teams update will stop you overloading your cloud storage - Techradar
Remembering what was said in a Microsoft Teams meeting has become a lot easier since Microsoft released its auto record feature last month but recording multiple meetings per day can take up a lot of storage.This is why in a new update to the Microsoft 365 roadmap, the software giant has revealed that it's currently working on a new feature that will prevent recorded Teams meetings from using up all of your cloud storage capacity.It's worth noting that not all meetings in Microsoft's  are recorded automatically as this feature needs to be set up using an administrative policy according to a support document. This is because auto recording was added to Teams for organizations that need to capture meeting interactions in order to comply with industry regulations or local laws.In its latest update to the Microsoft 365 roadmap, Microsoft revealed that it's developing a new feature that will allow Teams admins to set meeting recordings store on OneDrive and SharePoint to expire automatically.Once this feature rolls out in September, a default Teams policy setting will automatically delete meeting recordings stored in either OneDrive or SharePoint after a set amount of time. However, Teams admins will be able to modify the default meeting recording expiration time through a setting in the Teams Admin Portal or by modifying policy attributes using Powershell scripts.Going forward, meeting recordings will be automatically deleted once they reach their expiration date unless the meeting owner decides to push it back. Meeting owners won't have to worry about losing meeting recordings as well as Microsoft will notify them before a recording expires.High resolution video recordings of meetings can take up a lot of space in an organization's cloud storage but thanks to this new feature, companies will be able to save their recently recorded meetings without getting bogged down by having too many recordings of older meetings saved online.After living and working in South Korea for seven years, Anthony now resides in Houston, Texas where he writes about a variety of technology topics for ITProPortal and TechRadar. He has been a tech enthusiast for as long as he can remember and has spent countless hours researching and tinkering with PCs, mobile phones and game consoles.Thank you for signing up to TechRadar. You will receive a verification email shortly.There was a problem. Please refresh the page and try again.",https://cdn.mos.cms.futurecdn.net/LowE5V3dgYcMxtosuYBWkS-320-80.jpg
